### ISSUE TITLE
ET-4950 family: destination disappears from the panel after the first scan (host network mode)

### ISSUE THREAD

**Issue by mtheuma** [mtheuma/epson2paperless#219]
Split out from #169, where @marcelslaght reported this in [a comment](https://github.com/mtheuma/epson2paperless/issues/169#issuecomment-5653570506). The FF-680W report in #169 is a different model with a different symptom, so this gets its own thread.

**Report**

- Printer announces as `PID 11D1` (ET-4950 family), dialect resolved as `ET-4950 / ET-3950 / ET-4956`.
- Container runs with `network_mode: host`, on the same network as the printer. Paperless upload enabled.
- The first scan after a container restart works and uploads. After that, the destination name no longer appears on the printer's panel.
- Restarting the printer does not bring it back. Restarting the container does, for one more scan.
- Docker reports the container as up and healthy. `/health` returned `{"status":"ok","lastScan":"2026-09-13T12:49:57.019Z"}`.

<details>
<summary>Reporter's debug log (container start through the first scan)</summary>

```
2026-09-13T13:01:14.672Z [INFO] [startup] epson2paperless starting
2026-09-13T13:01:14.675Z [INFO] [startup] Printer target: 10.100.3.11
2026-09-13T13:01:14.676Z [INFO] [startup] Destination name: B-Paperless
2026-09-13T13:01:14.676Z [INFO] [startup] Output directory: /output
2026-09-13T13:01:14.676Z [INFO] [startup] Paperless upload: enabled (https://xxx.domain) — local files deleted after successful upload
2026-09-13T13:01:14.676Z [INFO] [startup] Printer cert pinning: disabled (set PRINTER_PROTOCOL=esci2 + PRINTER_CERT_FINGERPRINT to enable)
2026-09-13T13:01:14.676Z [INFO] [startup] Protocol: auto (TLS-probe at first scan)
2026-09-13T13:01:14.676Z [INFO] [startup] JPEG quality: 90
2026-09-13T13:01:14.681Z [INFO] [startup] Route to printer 10.100.3.11: via local address 10.100.3.100
2026-09-13T13:01:14.684Z [INFO] [keepalive] Keepalive responder listening on 239.255.255.253:2968 — waiting for printer announcements
2026-09-13T13:01:14.689Z [INFO] [main] Scan webhook disabled (SCAN_TRIGGER_TOKEN unset)
2026-09-13T13:01:14.690Z [INFO] [main] epson2paperless ready — waiting for scan from printer panel
2026-09-13T13:01:14.691Z [INFO] [pushscan] PushScan server listening on TCP port 2968
2026-09-13T13:01:14.692Z [INFO] [health] Health check server listening on port 3000
2026-09-13T13:01:49.991Z [INFO] [keepalive] Printer announcement received from 10.100.3.11 — seq=0x18, product=PID 11D1; sending burst of 3 (keepalive v2.0)
2026-09-13T13:01:49.993Z [DEBUG] [keepalive] Keepalive burst #1/3 sent to 10.100.3.11:2968 seq=0x18
2026-09-13T13:01:50.493Z [DEBUG] [keepalive] Keepalive burst #2/3 sent to 10.100.3.11:2968 seq=0x18
2026-09-13T13:01:50.994Z [DEBUG] [keepalive] Keepalive burst #3/3 sent to 10.100.3.11:2968 seq=0x18
2026-09-13T13:01:55.734Z [DEBUG] [pushscan] Connection opened from ::ffff:10.100.3.11:43490
2026-09-13T13:01:55.737Z [INFO] [pushscan] Received PushScan request
2026-09-13T13:01:55.737Z [DEBUG] [pushscan] Request headers POST /PushScan HTTP/1.0
Content-Type: application/octet-stream
Content-Length: 306
x-protocol-name: Epson Network Service Protocol
x-protocol-version: 2.00
x-uid: 9
2026-09-13T13:01:55.737Z [DEBUG] [pushscan] Request body <?xml version="1.0" ?><s:Envelope xmlns:s="http://www.w3.org/2003/05/soap-envelope"><s:Body><p:PushScan xmlns:p="http://schema.epson.net/EpsonNet/Scan/2004/pushscan"><ProductNameIn>PID 11D1</ProductNameIn><IPAddressIn>0A64030B</IPAddressIn><PushScanIDIn>02</PushScanIDIn></p:PushScan></s:Body></s:Envelope>
2026-09-13T13:01:55.738Z [DEBUG] [pushscan] Echoing x-uid : 9
2026-09-13T13:01:55.738Z [DEBUG] [pushscan] Sent pushScan response
2026-09-13T13:01:55.739Z [INFO] [pushscan] Scan requested: product=PID 11D1, id=02, job=null
2026-09-13T13:01:55.739Z [INFO] [startup] PushScan received (duplex=false, action=pdf) — starting scan session
2026-09-13T13:01:55.817Z [INFO] [protocol-probe] Detected protocol variant for 10.100.3.11: esci2
2026-09-13T13:01:55.948Z [DEBUG] [scanner-esci2] Dialect resolved {
  name: 'ET-4950 / ET-3950 / ET-4956 (ESC/I-2 over TLS)',
  fingerprint: '2fb08fc1bde6d17291b2ffb702dbc6b7de88899c9215d0e3267e7c51409df3e2'
}
2026-09-13T13:01:56.010Z [DEBUG] [scanner-esci2] Source detected from first STAT { statLength: 12, source: 'flatbed' }
2026-09-13T13:02:15.663Z [DEBUG] [pdf] embedded page 1/1 (2455143 B)
2026-09-13T13:02:15.683Z [INFO] [output] Saved scan to /output/scan_2026-09-13_150155.pdf (2456094 bytes)
2026-09-13T13:02:15.686Z [INFO] [output-tail] Scan complete — saved PDF to /output/scan_2026-09-13_150155.pdf
2026-09-13T13:02:15.687Z [INFO] [paperless] Uploading 1 file(s) to Paperless-ngx
2026-09-13T13:02:16.828Z [INFO] [paperless] Paperless upload complete: scan_2026-09-13_150155.pdf → "0fff418a-3f2d-4b8c-8c0c-856cbbdfd983"
2026-09-13T13:02:16.829Z [DEBUG] [paperless] Deleted local file after upload: /output/scan_2026-09-13_150155.pdf
```

</details>

**Status**

The log covers only the first 30 seconds after the printer's announcement, and the printer announces about once a minute, so it doesn't yet show whether announcements keep arriving. Diagnostics requested in the first comment below.

**Comment by mtheuma** [comment]
Hi @marcelslaght ,

Thanks for the detailed log. I've moved your report here since it looks like a different failure from the FF-680W one in #169 (different model, and the destination vanishing rather than an error icon).

It seems like the printer's announcements stop reaching the container at some point, and I'd like to work out whether that's tied to the scan or to time passing. The printer announces itself about once a minute, so a log that runs from a container restart through to the destination disappearing would show that. A few things would help:

**1. Which image tag are you running?**

**2. An idle test, with `LOG_LEVEL=debug` on throughout:**

1. Restart the container and confirm the destination appears on the printer.
2. Leave it running for ten minutes without scanning.
3. Check whether the destination is still there, then try a scan.

Could you send the full log from the restart through to the point where the destination is gone, plus the `/health` output from that same run?

**3. If it reproduces, could you run a packet capture on the Docker host?** Start it before the container restart and stop it once the destination has disappeared:

```
tcpdump -ni <interface> 'udp port 2968 or igmp' -w discovery.pcap
```

That filter only captures the printer's announcements, our replies and the network's group-membership traffic, no scan data, so it's fine to attach here or email to `epson2paperless.vineyard182@passmail.com` if you'd rather.

**4. Two quick questions:**

- What router or switch sits between the printer and the Docker host, and does it have IGMP snooping enabled?
- Is there a second epson2paperless instance on the network (the `B-` prefix made me wonder)? Two instances on the same host can knock each other's destination off the printer, so it would be good to rule that out.

Thanks!

**Comment by marcelslaght** [comment]
Hi @mtheuma,

Thanks for the follow-up! 
Here's what I found:

1. **Image:** `ghcr.io/mtheuma/epson2paperless:latest` (today), digest `sha256:cf419818bcba8ff6ac88d8211723e967033ebc7d9fac6715d297030c0d34510c`

2. **Idle test:** Restarted at 17:05:27 UTC, destination appeared immediately. Without scanning, it was gone after ~5-10 minutes and the printer no longer offers a destination to scan to.

/health at that point:
{"status":"ok","lastScan":null}

Full debug log:

```
2026-09-13T17:05:27.230Z [INFO] [startup] epson2paperless starting
2026-09-13T17:05:27.232Z [INFO] [startup] Printer target: 10.100.3.11
2026-09-13T17:05:27.232Z [INFO] [startup] Destination name: B-Paperless
2026-09-13T17:05:27.232Z [INFO] [startup] Output directory: /output
2026-09-13T17:05:27.233Z [INFO] [startup] Paperless upload: enabled (https://[redacted]) — local files deleted after successful upload
2026-09-13T17:05:27.233Z [INFO] [startup] Printer cert pinning: disabled (set PRINTER_PROTOCOL=esci2 + PRINTER_CERT_FINGERPRINT to enable)
2026-09-13T17:05:27.233Z [INFO] [startup] Protocol: auto (TLS-probe at first scan)
2026-09-13T17:05:27.233Z [INFO] [startup] JPEG quality: 90
2026-09-13T17:05:27.235Z [INFO] [startup] Route to printer 10.100.3.11: via local address 10.100.3.100
2026-09-13T17:05:27.236Z [INFO] [keepalive] Keepalive responder listening on 239.255.255.253:2968 — waiting for printer announcements
2026-09-13T17:05:27.238Z [INFO] [main] Scan webhook disabled (SCAN_TRIGGER_TOKEN unset)
2026-09-13T17:05:27.239Z [INFO] [main] epson2paperless ready — waiting for scan from printer panel
2026-09-13T17:05:27.239Z [INFO] [pushscan] PushScan server listening on TCP port 2968
2026-09-13T17:05:27.240Z [INFO] [health] Health check server listening on port 3000
2026-09-13T17:05:51.061Z [INFO] [keepalive] Printer announcement received from 10.100.3.11 — seq=0x04, product=PID 11D1; sending burst of 3 (keepalive v2.0)
2026-09-13T17:05:51.063Z [DEBUG] [keepalive] Keepalive burst #1/3 sent to 10.100.3.11:2968 seq=0x04
2026-09-13T17:05:51.562Z [DEBUG] [keepalive] Keepalive burst #2/3 sent to 10.100.3.11:2968 seq=0x04
2026-09-13T17:05:52.063Z [DEBUG] [keepalive] Keepalive burst #3/3 sent to 10.100.3.11:2968 seq=0x04
```

No further lines for the rest of the ~10-minute window.

3. **Packet capture** (17:05:26-17:18 UTC, `udp port 2968 or igmp`):

```
2026-09-13 17:05:26.804266 IP 10.100.3.100 > 224.0.0.22: igmp v3 report, 1 group record(s)
2026-09-13 17:05:27.239265 IP 10.100.3.100 > 224.0.0.22: igmp v3 report, 1 group record(s)
2026-09-13 17:05:27.377520 IP 10.100.3.100 > 224.0.0.22: igmp v3 report, 1 group record(s)
2026-09-13 17:05:51.059337 IP 10.100.3.11.2968 > 239.255.255.253.2968: UDP, length 92
2026-09-13 17:05:51.063316 IP 10.100.3.100.2968 > 10.100.3.11.2968: UDP, length 87
2026-09-13 17:05:51.562397 IP 10.100.3.100.2968 > 10.100.3.11.2968: UDP, length 87
2026-09-13 17:05:52.063130 IP 10.100.3.100.2968 > 10.100.3.11.2968: UDP, length 87
```

4. **Router/switch:** Zyxel GS1900-24E, IGMP snooping disabled; **Second instance:** confirmed not active/online.

Happy to run anything else that'd help narrow it down further if needed.

Thank you!

**Comment by mtheuma** [comment]
Hi @marcelslaght ,

Thanks, that answers the timing question: it isn't the scan, and your capture rules out the switch.

The relevant bit of how this works: the printer doesn't announce itself on a timer. It announces when it powers on, when you use the panel's refresh action, and every time you open Scan > Computer, and the list shows whoever answered that announcement. So the first time you open Scan > Computer after a container restart, the announcement reaches the Docker host and the destination appears. A few minutes later it no longer does. The only thing a container restart changes on the network is that the host re-joins the multicast group, which points at something between the printer and the host no longer forwarding the announcements. Three things would help pin that down:

**1. Is the printer on Wi-Fi or Ethernet?**

**2. A Wireshark capture from a second machine while the host is in the failed state.** This tells us whether the printer is still announcing and the Docker host just isn't hearing it.

Prerequisite: Wireshark installed on a laptop or PC on the same network as the printer (any OS).

1. Get the setup into the failed state: restart the container, confirm the destination appears, then leave the printer alone for ten minutes.
2. On the second machine, start a Wireshark capture with `udp port 2968` in the "Capture filter" field. Keep the container's debug log running too.
3. Open Scan > Computer on the printer. Wait ten seconds, back out, and open it again.
4. Stop the capture and save it as `announce-second-machine.pcapng`.

The capture only contains the printer's announcements and replies to them, no scan data, so it's fine to attach here along with the container log from the same run, or you can email it to `epson2paperless.vineyard182@passmail.com`.

**3. Printer model and firmware version**, from Settings > General Settings > Firmware Update.

Thanks!
